{
  "kind": "example_value",
  "name": "Example Title",
  "fullPath": "example_value",
  "generation": 10,
  "selfLink": "example_value",
  "alwaysSend": "example_value",
  "cookieEncryption": "example_value",
  "cookieName": "example_value",
  "defaultsFrom": "example_value",
  "description": "A sample description.",
  "expiration": "example_value",
  "hashLength": 10,
  "hashOffset": 10,
  "httponly": "example_value",
  "matchAcrossPools": "example_value",
  "matchAcrossServices": "example_value",
  "matchAcrossVirtuals": "example_value",
  "method": "example_value",
  "mirror": "example_value",
  "overrideConnectionLimit": "example_value",
  "secure": "example_value",
  "timeout": "example_value"
}